{
  "schema_version": 2,
  "name": "ripgrep",
  "description": "快速递归文本搜索工具，用于查找代码和文件内容，支持 Unicode、忽略规则和 PCRE2 正则表达式。",
  "upstream": "https://github.com/BurntSushi/ripgrep",
  "repository": "https://github.com/oheco/ripgrep",
  "maintainers": [
    {
      "github": "kdada",
      "name": "Guo Wei"
    }
  ],
  "license": "MIT OR Unlicense",
  "latest": {
    "ohos-arm64": "15.0.0-ohos.2"
  },
  "versions": [
    {
      "version": "15.0.0-ohos.2",
      "upstream_version": "15.0.0",
      "artifacts": {
        "ohos-arm64": {
          "url": "https://github.com/oheco/ripgrep/releases/download/v15.0.0-ohos.2/ripgrep-15.0.0-ohos.2-ohos-arm64.tar.gz",
          "sha256": "b19f18c41e396d3b194892861003ef34002504c02fbf1093063111d8faa3ac14",
          "size": 9451961,
          "format": "tar.gz",
          "strip_components": 1,
          "binaries": {
            "rg": "bin/rg"
          },
          "launchers": [
            "rg"
          ]
        }
      }
    },
    {
      "version": "15.0.0-ohos.1",
      "upstream_version": "15.0.0",
      "artifacts": {
        "ohos-arm64": {
          "url": "https://github.com/oheco/ripgrep/releases/download/v15.0.0-ohos.1/ripgrep-15.0.0-ohos.1-ohos-arm64.tar.gz",
          "sha256": "9e867b6c2fc66234cf6393a8296a2a9affb2e769b2c4a6d3c5ffc7883872cf44",
          "size": 9442723,
          "format": "tar.gz",
          "strip_components": 1,
          "binaries": {
            "rg": "bin/rg"
          },
          "launchers": [
            "rg"
          ]
        }
      }
    }
  ],
  "notes": "命令为 rg，可用 rg -n '模式' 目录 搜索文本，前后查找或反向引用需用 -P 启用 PCRE2。默认遵循忽略规则并跳过隐藏和二进制文件，按需用 -uuu 取消过滤。运行无需 Node.js，外部预处理器和压缩工具需自行提供。"
}
