{
  "schema_version": 2,
  "name": "nodejs",
  "description": "Node.js 24 LTS 运行时，用于运行 JavaScript 工具和服务，包含 npm、npx、Corepack 与开发头文件。支持 JIT、WebAssembly、Inspector 和 SQLite。",
  "upstream": "https://github.com/nodejs/node",
  "repository": "https://github.com/oheco/node",
  "maintainers": [
    {
      "github": "kdada",
      "name": "Guo Wei"
    }
  ],
  "license": "MIT (with bundled third-party licenses)",
  "notes": "运行纯 JavaScript 无需 Python 或 SDK，安装全局命令时检查所选 npm prefix 的 bin 是否在 PATH。原生扩展编译需另装 Python 3、SDK Clang/Clang++、GNU Make 和 binary-sign-tool，并使用应用私有可写 TMPDIR。随包 npm/node-gyp 负责扩展编译和签名，单独升级 npm 可能覆盖这些功能；通用 Linux ARM64 预编译扩展不兼容。",
  "latest": {
    "ohos-arm64": "24.21.0-ohos.1"
  },
  "versions": [
    {
      "version": "24.21.0-ohos.1",
      "upstream_version": "24.21.0",
      "artifacts": {
        "ohos-arm64": {
          "url": "https://github.com/oheco/node/releases/download/v24.21.0-ohos.1/node-v24.21.0-ohos.1-arm64.tar.gz",
          "sha256": "645480717771f5eb51f8f4398d1bf706d47a5b08356d41ae51ca0a932ad01052",
          "size": 56619315,
          "format": "tar.gz",
          "strip_components": 1,
          "binaries": {
            "node": "bin/node",
            "npm": "bin/npm",
            "npx": "bin/npx",
            "corepack": "bin/corepack"
          },
          "launchers": [
            "node",
            "npm",
            "npx",
            "corepack"
          ]
        }
      }
    }
  ]
}
