{
  "schema_version": 2,
  "name": "git",
  "description": "分布式版本管理工具，用于代码提交、分支协作、合并与变基。新版新增 HTTP/HTTPS 远端传输，可通过本地、SSH 或 HTTP/HTTPS 克隆和同步仓库。",
  "upstream": "https://github.com/git/git",
  "repository": "https://github.com/oheco/git",
  "maintainers": [
    {
      "github": "kdada",
      "name": "Guo Wei"
    }
  ],
  "license": "GPL-2.0-only (with compatible bundled licenses)",
  "notes": "本地克隆请加 --no-hardlinks；共享目录出现 dubious ownership 时，核对路径后只为具体仓库设置 safe.directory。HTTPS 默认校验系统 CA，私有 CA 可用 http.sslCAInfo 配置；SSH 需系统 ssh 和自己的密钥。交互分页另装 less，大文件管理另装 git-lfs 并在仓库执行 git lfs install --local。HTTP 传输使用 HTTP/1.1，不支持 HTTP/2/3 或旧式 WebDAV push；简短帮助可用 git <command> -h。",
  "latest": {
    "ohos-arm64": "2.55.0-ohos.2"
  },
  "versions": [
    {
      "version": "2.55.0-ohos.2",
      "upstream_version": "2.55.0",
      "artifacts": {
        "ohos-arm64": {
          "url": "https://github.com/oheco/git/releases/download/v2.55.0-ohos.2/git-2.55.0.ohos.2-ohos-arm64.tar.gz",
          "sha256": "8b568334e7decd6381d1a162fde79d44f67f8e9513454d4b148759c527bada81",
          "size": 5588391,
          "format": "tar.gz",
          "strip_components": 1,
          "binaries": {
            "git": "bin/git",
            "git-shell": "bin/git-shell",
            "git-upload-pack": "bin/git-upload-pack",
            "git-receive-pack": "bin/git-receive-pack",
            "git-upload-archive": "bin/git-upload-archive"
          },
          "launchers": [
            "git",
            "git-shell",
            "git-upload-pack",
            "git-receive-pack",
            "git-upload-archive"
          ]
        }
      }
    },
    {
      "version": "2.55.0-ohos.1",
      "upstream_version": "2.55.0",
      "artifacts": {
        "ohos-arm64": {
          "url": "https://github.com/oheco/git/releases/download/v2.55.0-ohos.1/git-2.55.0.ohos.1-ohos-arm64.tar.gz",
          "sha256": "dcd148efdbfa2b5693cb88115ff23cd61a94fd4f5d93bef27c5507cf2de0e70f",
          "size": 3132403,
          "format": "tar.gz",
          "strip_components": 1,
          "binaries": {
            "git": "bin/git",
            "git-shell": "bin/git-shell",
            "git-upload-pack": "bin/git-upload-pack",
            "git-receive-pack": "bin/git-receive-pack",
            "git-upload-archive": "bin/git-upload-archive"
          },
          "launchers": [
            "git",
            "git-shell",
            "git-upload-pack",
            "git-receive-pack",
            "git-upload-archive"
          ]
        }
      }
    }
  ]
}
