{
  "schema_version": 2,
  "name": "ohos-sdk-native",
  "description": "OpenHarmony 原生开发 SDK，包含 LLVM/Clang、sysroot、CMake 和 Ninja",
  "upstream": "https://gitee.com/openharmony",
  "repository": "https://github.com/oheco/ohos-sdk",
  "maintainers": [
    {
      "github": "kdada",
      "name": "Guo Wei"
    }
  ],
  "license": "Multiple (see NOTICE.txt)",
  "notes": "LLVM 15.0.4；CMake/CTest/CPack 3.28.2；Ninja 1.13.2。编译鸿蒙程序可使用 aarch64-unknown-linux-ohos-clang/clang++，它们自动指定随包 sysroot；CMake 工具链文件为 build/cmake/ohos.toolchain.cmake。编译产物签名需另装 ohos-sdk-toolchains。sysroot 中 8 对仅大小写不同的 netfilter 头文件默认保留小写版本，需要大写变体中定义的代码需另行适配。当前不支持 LLDB，不创建相关命令链接。",
  "latest": {
    "ohos-arm64": "26.0.0.35-Beta"
  },
  "versions": [
    {
      "version": "26.0.0.35-Beta",
      "upstream_version": "26.0.0.35",
      "artifacts": {
        "ohos-arm64": {
          "url": "https://github.com/oheco/ohos-sdk/releases/download/26.0.0.35-Beta/native-ohos-arm64-26.0.0.35-Beta.zip",
          "sha256": "07baa4ab8fa2e240c0675560678beb452c679ef52fa7f6a302f362d9821c04cc",
          "size": 949054580,
          "format": "zip",
          "strip_components": 1,
          "binaries": {
            "FileCheck": "llvm/bin/FileCheck",
            "aarch64-unknown-linux-ohos-clang": "llvm/bin/aarch64-unknown-linux-ohos-clang",
            "aarch64-unknown-linux-ohos-clang++": "llvm/bin/aarch64-unknown-linux-ohos-clang++",
            "armv7-unknown-linux-ohos-clang": "llvm/bin/armv7-unknown-linux-ohos-clang",
            "armv7-unknown-linux-ohos-clang++": "llvm/bin/armv7-unknown-linux-ohos-clang++",
            "clang": "llvm/bin/clang",
            "clang++": "llvm/bin/clang++",
            "clang-15": "llvm/bin/clang-15",
            "clang-check": "llvm/bin/clang-check",
            "clang-cl": "llvm/bin/clang-cl",
            "clang-cpp": "llvm/bin/clang-cpp",
            "clang-format": "llvm/bin/clang-format",
            "clang-tidy": "llvm/bin/clang-tidy",
            "clangd": "llvm/bin/clangd",
            "cmake": "build-tools/cmake/bin/cmake",
            "cpack": "build-tools/cmake/bin/cpack",
            "ctest": "build-tools/cmake/bin/ctest",
            "dsymutil": "llvm/bin/dsymutil",
            "ld.lld": "llvm/bin/ld.lld",
            "ld64.lld": "llvm/bin/ld64.lld",
            "llc": "llvm/bin/llc",
            "lld": "llvm/bin/lld",
            "lld-link": "llvm/bin/lld-link",
            "llvm-addr2line": "llvm/bin/llvm-addr2line",
            "llvm-ar": "llvm/bin/llvm-ar",
            "llvm-as": "llvm/bin/llvm-as",
            "llvm-cfi-verify": "llvm/bin/llvm-cfi-verify",
            "llvm-config": "llvm/bin/llvm-config",
            "llvm-cov": "llvm/bin/llvm-cov",
            "llvm-cxxfilt": "llvm/bin/llvm-cxxfilt",
            "llvm-dis": "llvm/bin/llvm-dis",
            "llvm-dwarfdump": "llvm/bin/llvm-dwarfdump",
            "llvm-dwp": "llvm/bin/llvm-dwp",
            "llvm-lib": "llvm/bin/llvm-lib",
            "llvm-link": "llvm/bin/llvm-link",
            "llvm-modextract": "llvm/bin/llvm-modextract",
            "llvm-nm": "llvm/bin/llvm-nm",
            "llvm-objcopy": "llvm/bin/llvm-objcopy",
            "llvm-objdump": "llvm/bin/llvm-objdump",
            "llvm-profdata": "llvm/bin/llvm-profdata",
            "llvm-ranlib": "llvm/bin/llvm-ranlib",
            "llvm-rc": "llvm/bin/llvm-rc",
            "llvm-readelf": "llvm/bin/llvm-readelf",
            "llvm-readobj": "llvm/bin/llvm-readobj",
            "llvm-size": "llvm/bin/llvm-size",
            "llvm-strings": "llvm/bin/llvm-strings",
            "llvm-strip": "llvm/bin/llvm-strip",
            "llvm-symbolizer": "llvm/bin/llvm-symbolizer",
            "loongarch64-unknown-linux-ohos-clang": "llvm/bin/loongarch64-unknown-linux-ohos-clang",
            "loongarch64-unknown-linux-ohos-clang++": "llvm/bin/loongarch64-unknown-linux-ohos-clang++",
            "ninja": "build-tools/cmake/bin/ninja",
            "opt": "llvm/bin/opt",
            "sancov": "llvm/bin/sancov",
            "sanstats": "llvm/bin/sanstats",
            "x86_64-unknown-linux-ohos-clang": "llvm/bin/x86_64-unknown-linux-ohos-clang",
            "x86_64-unknown-linux-ohos-clang++": "llvm/bin/x86_64-unknown-linux-ohos-clang++",
            "yaml2obj": "llvm/bin/yaml2obj"
          },
          "launchers": [
            "FileCheck",
            "aarch64-unknown-linux-ohos-clang",
            "aarch64-unknown-linux-ohos-clang++",
            "armv7-unknown-linux-ohos-clang",
            "armv7-unknown-linux-ohos-clang++",
            "clang",
            "clang++",
            "clang-15",
            "clang-check",
            "clang-cl",
            "clang-cpp",
            "clang-format",
            "clang-tidy",
            "clangd",
            "cmake",
            "cpack",
            "ctest",
            "dsymutil",
            "ld.lld",
            "ld64.lld",
            "llc",
            "lld",
            "lld-link",
            "llvm-addr2line",
            "llvm-ar",
            "llvm-as",
            "llvm-cfi-verify",
            "llvm-config",
            "llvm-cov",
            "llvm-cxxfilt",
            "llvm-dis",
            "llvm-dwarfdump",
            "llvm-dwp",
            "llvm-lib",
            "llvm-link",
            "llvm-modextract",
            "llvm-nm",
            "llvm-objcopy",
            "llvm-objdump",
            "llvm-profdata",
            "llvm-ranlib",
            "llvm-rc",
            "llvm-readelf",
            "llvm-readobj",
            "llvm-size",
            "llvm-strings",
            "llvm-strip",
            "llvm-symbolizer",
            "loongarch64-unknown-linux-ohos-clang",
            "loongarch64-unknown-linux-ohos-clang++",
            "ninja",
            "opt",
            "sancov",
            "sanstats",
            "x86_64-unknown-linux-ohos-clang",
            "x86_64-unknown-linux-ohos-clang++",
            "yaml2obj"
          ]
        }
      }
    }
  ]
}
