{
  "schema_version": 2,
  "name": "gh",
  "description": "GitHub 命令行工具，可在终端管理仓库、Issue、PR、Release 和 Actions，附带手册页与 shell 补全。",
  "upstream": "https://github.com/cli/cli",
  "repository": "https://github.com/oheco/gh",
  "maintainers": [
    {
      "github": "kdada",
      "name": "Guo Wei"
    }
  ],
  "license": "MIT",
  "notes": "设备码和浏览器登录不可用，请设置 GH_TOKEN，或用 gh auth login --with-token 从标准输入读取令牌。用 GH_CONFIG_DIR 指定应用私有配置目录，避免把持久凭据放在不能落实私有权限的共享 HOME。涉及克隆、提交和推送时需另装 git，并配置 Git 的认证凭据。",
  "latest": {
    "ohos-arm64": "2.100.0-ohos.1"
  },
  "versions": [
    {
      "version": "2.100.0-ohos.1",
      "upstream_version": "2.100.0",
      "artifacts": {
        "ohos-arm64": {
          "url": "https://github.com/oheco/gh/releases/download/v2.100.0-ohos.1/gh-2.100.0-ohos.1-ohos-arm64.tar.gz",
          "sha256": "58e48380b8a687b37038551c615a04b84866222b36d491820c9708227131da22",
          "size": 13798384,
          "format": "tar.gz",
          "strip_components": 1,
          "binaries": {
            "gh": "bin/gh"
          },
          "launchers": [
            "gh"
          ]
        }
      }
    }
  ]
}
