{
  "schema_version": 2,
  "name": "oheco-broker",
  "description": "加密端口映射工具，用于远程访问本地服务，支持自动重连和符合条件的 TCP 会话恢复，提供独立服务端及 C、Go、.NET 源码 SDK。0.5.0 新增账户令牌自动刷新，可保持现有连接和映射端口。",
  "upstream": "https://github.com/oheco/oheco-broker",
  "repository": "https://github.com/oheco/oheco-broker",
  "maintainers": [
    {
      "github": "kdada",
      "name": "Guo Wei"
    }
  ],
  "license": "MIT",
  "notes": "0.5.0 的 C SDK、Go/cgo SDK 与 CLI 提供可选账户 token 自动刷新：access 默认24小时、提前10分钟并加入抖动刷新，refresh 闲置30天滑动期限，绝对登录寿命默认无限；服务器只保存凭据摘要。轮转保持原 peer、TCP socket、映射端口、逻辑连接代数及 TURN allocation，退出、禁用及显式撤销仍立即撤权。CLI v2 配置不保存密码；旧配置显式 tenant login 一次后进入自动刷新，tenant refresh 可手动触发。共享配置使用原锁、fsync journal 和原子提交，支持多进程、丢回包与提交后崩溃恢复；--legacy-auth 可生成旧配置，混用旧客户端需独立 --config。机制与迁移：https://github.com/oheco/oheco-broker/blob/v0.5.0/docs/AUTH-REFRESH.md 。保留有限自动重连、非阻塞手动重连、状态查询与可选事件；CLI 可用 SIGUSR1 请求手动重连。透明 TCP 续传要求双方支持映射 v2、原授权有效、逻辑上下文和目标 socket 存活，并在原流期限内恢复；交付 ACK 不代表应用持久化确认。旧版对端使用 v1。TURN 正向授权缓存失效按具体权限范围处理，保留租约检查；直接数据库修改由后台异步观察。注册默认审批且 relay 默认禁用，审批与 relay 授权分开。升级把 SQLite schema 1/2 事务迁移到3；升级前做 SQLite 正规备份，旧服务拒绝 schema3，回退必须恢复升级前数据库。安装不自动部署或替换运行中的进程。Linux amd64/arm64 Docker 镜像 ghcr.io/oheco/oheco-broker:0.5.0 包含完整 CLI 和独立服务端，支持内置 ACME 与外部证书 TLS；部署说明：https://github.com/oheco/oheco-broker/blob/v0.5.0/docs/DOCKER.md 。CLI 启动器加载随包签名 C++ runtime，独立服务端只依赖系统 C 运行库。安装后的 sdk/ 提供 C、Go、.NET 完整源码、固定依赖、许可证及离线构建资源；独立源码附件：https://github.com/oheco/oheco-broker/releases/download/v0.5.0/oheco-broker-0.5.0-sdk-source.tar.gz 。源码 SDK 不提供预编译 SDK 库；构建需要原生 C/C++、CMake、Ninja、Python，Go 消费需要 Go/cgo，.NET 本机命令 SDK 需要 .NET 10。TURN 当前使用 UDP/IPv4，UDP 为尽力交付；无 TUN，不保证所有 NAT 拓扑。原无鉴权本机命令服务须显式 shell serve，仅适合可信本机开发。0.1.0、0.2.0、0.3.0、0.4.0 的发行文件及下载地址保持不可变。",
  "latest": {
    "ohos-arm64": "0.5.0"
  },
  "versions": [
    {
      "version": "0.1.0",
      "artifacts": {
        "ohos-arm64": {
          "url": "https://github.com/oheco/oheco-broker/releases/download/v0.1.0/oheco-broker-0.1.0-ohos-arm64.tar.gz",
          "sha256": "b36048757a045bc4b3ff02dd203e89494dc66f8706407d452faf58536d5a8791",
          "size": 2101299,
          "format": "tar.gz",
          "strip_components": 1,
          "binaries": {
            "oheco-broker": "bin/oheco-broker"
          }
        }
      }
    },
    {
      "version": "0.2.0",
      "artifacts": {
        "ohos-arm64": {
          "url": "https://github.com/oheco/oheco-broker/releases/download/v0.2.0/oheco-broker-0.2.0-ohos-arm64.tar.gz",
          "sha256": "9f06af1ad45cf59f33feb2e4bfc0deaf4082e256417229f9db2a55d801e1fb60",
          "size": 2183397,
          "format": "tar.gz",
          "strip_components": 1,
          "binaries": {
            "oheco-broker": "bin/oheco-broker"
          }
        }
      }
    },
    {
      "version": "0.3.0",
      "artifacts": {
        "ohos-arm64": {
          "url": "https://github.com/oheco/oheco-broker/releases/download/v0.3.0/oheco-broker-0.3.0-ohos-arm64.tar.gz",
          "sha256": "57b17ebf1bcb768d1c480fca0207027719b9f54ae0830fcf2a016d779d2a973a",
          "size": 110389864,
          "format": "tar.gz",
          "strip_components": 1,
          "binaries": {
            "oheco-broker": "bin/oheco-broker",
            "oheco-broker-server": "bin/oheco-broker-server"
          }
        }
      }
    },
    {
      "version": "0.4.0",
      "artifacts": {
        "ohos-arm64": {
          "url": "https://github.com/oheco/oheco-broker/releases/download/v0.4.0/oheco-broker-0.4.0-ohos-arm64.tar.gz",
          "sha256": "1ee0359efe71ab64695659abc3ae999503c22af6e461950881d15819a047800d",
          "size": 110560203,
          "format": "tar.gz",
          "strip_components": 1,
          "binaries": {
            "oheco-broker": "bin/oheco-broker",
            "oheco-broker-server": "bin/oheco-broker-server"
          }
        }
      }
    },
    {
      "version": "0.5.0",
      "artifacts": {
        "ohos-arm64": {
          "url": "https://github.com/oheco/oheco-broker/releases/download/v0.5.0/oheco-broker-0.5.0-ohos-arm64.tar.gz",
          "sha256": "190c89f60dacbe0855b42f567abda873cecca37bac8d6f2d2fceb2f338b589d0",
          "size": 110700967,
          "format": "tar.gz",
          "strip_components": 1,
          "binaries": {
            "oheco-broker": "bin/oheco-broker",
            "oheco-broker-server": "bin/oheco-broker-server"
          }
        }
      }
    }
  ]
}
