{
  "schema_version": 2,
  "name": "less",
  "description": "终端文本分页器，用于浏览长文件、命令输出和 Git 日志，支持搜索、中文和彩色输出。",
  "upstream": "https://github.com/gwsw/less",
  "repository": "https://github.com/oheco/less",
  "maintainers": [
    {
      "github": "kdada",
      "name": "Guo Wei"
    }
  ],
  "license": "(GPL-3.0-or-later OR BSD-2-Clause) AND MIT",
  "notes": "静态集成 libtinfo 并随包提供常用 terminfo，可整体迁移。安装后 Git 默认分页器即可使用，无需修改 Git 配置。编辑器和 LESSOPEN 预处理器按用户配置另行提供。保留内置帮助和 less 文本/man 文档，不增加 Git 的完整帮助文档。",
  "latest": {
    "ohos-arm64": "704-ohos.1"
  },
  "versions": [
    {
      "version": "704-ohos.1",
      "upstream_version": "704",
      "artifacts": {
        "ohos-arm64": {
          "url": "https://github.com/oheco/less/releases/download/v704-ohos.1/less-704-ohos.1-ohos-arm64.tar.gz",
          "sha256": "0938622e1985b6f872be201e14f51ae16733ba36e4972db276e03761f9e98568",
          "size": 284236,
          "format": "tar.gz",
          "strip_components": 1,
          "binaries": {
            "less": "bin/less",
            "lesskey": "bin/lesskey"
          },
          "launchers": [
            "less",
            "lesskey"
          ]
        }
      }
    }
  ]
}
