{
  "schema_version": 2,
  "name": "dsh-godot-control",
  "description": "DSH 原生 Godot 编辑器控制插件，通过认证 WebSocket 提供场景、节点、脚本、资源与调试工具，无须 Python 或 MCP 后端。",
  "upstream": "https://github.com/hi-godot/godot-ai",
  "repository": "https://github.com/oheco/dsh-godot-control",
  "maintainers": [{"github": "kdada", "name": "Guo Wei"}],
  "license": "MIT",
  "notes": "这是无命令的数据插件包。安装后在 DSH 插件管理页从本地目录安装包根并启用 @oheco/dsh-godot-control，将 godot/addons/dsh_godot 复制到 Godot 项目的 addons 目录，再在两侧配对面板保存端口和令牌。需要已有 DSH（Node.js 24）与 Godot 4.7+ 的 4.x 编辑器；oo 不自动注册 DSH bundle 或修改 Godot 项目。保留 DSH 引用的安装目录，移除数据包前先卸载 bundle。已在鸿蒙真实 headless Godot 与实际 DSH 模型工具调用中验收核心工作流，161 个命令未逐项测试，图形 HAP 截图与音频行为未全面验收。",
  "latest": {"ohos-arm64": "0.1.0"},
  "versions": [
    {
      "version": "0.1.0",
      "upstream_version": "4.3.0",
      "artifacts": {
        "ohos-arm64": {
          "url": "https://github.com/oheco/dsh-godot-control/releases/download/dsh-v0.1.0/dsh-godot-control-0.1.0-ohos-arm64.zip",
          "sha256": "7897e2da27be8fe8ae0a73bddbe0b89320c73f3422637be43ee4db2b843e777b",
          "size": 20702082,
          "format": "zip",
          "strip_components": 1,
          "binaries": {}
        }
      }
    }
  ]
}
